No.,種類（1.読み 2.表外読み 3.熟語一字訓 4.書き取り 5.四字熟語 6.対義語類義語 7.故事諺）,問題,問題例,解答,備考,正解数,間違い数
64,7,しゅせい,創業は易く<しゅせい>は難し。,守成,-,0,0
65,7,かせい,百年<かせい>を俟つ。,河清,いつまで待っても無駄だということ。実現不可能なことを期待すること。,0,0
66,7,らんぼう,人を犯す者は<らんぼう>の患いあり。,乱亡,人に危難を与える者は、その報いで身を滅ぼすことになるということ。,0,0
70,7,うど,<うど>の大木,独活,-,0,0
114,7,ぜんこう,天地<ぜんこう>無し。,全功,天地（大自然）でさえ、完全無欠なものは何一つない。,0,0
115,7,とうこ,<とうこ>の筆。,董狐,権勢に屈せず、ありのままに歴史を記すこと。中国、晋(シン)の霊公(レイコウ)が、趙穿(チョウセン)に殺されたとき、執政の大臣で同じく趙一族の趙盾(チョウトン)が趙穿を討伐しなかったことを、当時の晋の史官の董狐が、趙盾に罪があるとして「趙盾、その君を殺す」と記録した故事から。,0,0
151,7,りじ,大声<りじ>に入らず。,里耳,高尚な理論は俗人にはなかなか理解されにくいということ。「大声」は高尚な音楽、「里耳」は俗人の耳のこと。,0,0
152,7,きんきょ,人古今に通ぜざるは馬牛にして<きんきょ>す。,襟裾,古今の道理を解さない無学な人は、馬や牛が衣服を着たようなもので、人としての価値がない。,0,0
158,7,ぐこう,<ぐこう>山を移す。,愚公,どんなに困難なことでも努力を続ければ、やがては成就するというたとえ。,0,0
159,7,ごすい,天上の<ごすい>人間の一炊。,五衰,天人(てんにん)の死が近づく時に現われる五つの死相。天人の五衰。,0,0
160,7,こしょう,<こしょう>鳴らし難し。,孤掌,《片方の手のひらだけでは、手を打ち鳴らせないところから》人間は一人だけでは生きられないこと、事をなしとげられないことのたとえ。,0,0
170,7,そうか,累々として<そうか>の狗のごとし。,喪家,不幸のあった家で、家人が悲しみのあまりえさをやるのを忘れ、元気のなくなった犬。転じて、ひどくやつれて元気のない人。一説に、宿なしになった犬の意とも。,0,0
173,1,禰祖,父と祖父の御霊屋を<禰祖>という。,でいそ,-,0,0
174,3,卦兆・卦い,<卦兆>・<卦い>,かちょう・うらない,-,0,0
175,4,とくがく,知る人ぞ知る<とくがく>の士である。,篤学,-,0,0
176,4,こんとく,<こんとく>な御言葉を賜った。,懇篤,懇切丁寧で、心がこもっていること。,0,0
177,4,ものすごい,<ものすごい>人手だった。,物凄い,-,0,0
178,5,がいかんじてい,<がいかんじてい>,蓋棺事定,その人の生前の評価はあてにならず、死後になってはじめて定まること。,0,0
179,6,わぼく,抗争⇔<わぼく>,和睦,-,0,0
180,4,どうけい,<どうけい>を抱く。,憧憬,-,0,0
181,1,階梯,幾多の<階梯>を経る。,かいてい,１ 学問・芸術などの手ほどき。また、それを説いた書物。入門書。「英語階梯」２ 学問・芸術などを学ぶ段階。また、物事の発展の過程。,0,0
182,7,きこ,<きこ>の勢い。,騎虎,虎に乗った者は途中で降りると虎に食われてしまうので降りられないように、やりかけた物事を、行きがかり上途中でやめることができなくなることのたとえ。,0,0
183,1,婁宿,<婁宿>の清朗なる夜に月を翫ぶ。,ろうしゅく,インド発祥の占星術である「宿曜占星術（27宿）」や、天文学の「二十八宿」の一つ,0,0
184,2,攻める,宗匠について俳諧の道を<攻める>。,おさめる,-,0,0
185,6,そこつ,不調法=<そこつ>,粗忽,-,0,0
186,7,のうじ,<のうじ>畢われり。,能事,自分のなすべきことは全部終わった。能事足れり。,0,0
187,7,たいかん,<たいかん>は忠に似たり。,大姦,大悪人は、自分の本性を隠したくみに振る舞うので、いかにも忠臣のように見えるということ。,0,0
188,5,こうけんようふ,<こうけんようふ>,黄絹幼婦,二人の判断が完全に同じになること。または、物事を正確に理解すること。または、「絶妙」という言葉の隠語。または、素晴らしい文章のたとえ。「黄絹」は色のついている糸という意味で、漢字の「絶」のこと。「幼婦」は少女という意味で、漢字の「妙」のこと。,0,0
189,5,ていえいそうかん,<ていえいそうかん>,鄭衛桑間,国を滅亡に導くほどの下品で淫靡な音楽のこと。「鄭」と「衛」は中国春秋時代の国名。「桑間」は衛の地名。両国の音楽はみだらなものであったとされていることから。「鄭衛之音」ともいう。,0,0
190,5,たいざんりょうぼく,<たいざんりょうぼく>,泰山梁木,立派で優れている人物のこと。「泰山頽れ梁木壊る」という言葉を略したもので、孔子が自身の死を予見して歌ったとされ、立派で優れている人物の死を意味するようになった。「泰山」は中国の山東省にある山の名前。「梁木」は屋根を支えている長く太い木、梁のこと。,0,0
191,5,てんぽうきゅうじょ,<てんぽうきゅうじょ>,天保九如,長生きすることを願う言葉。「天保」は『詩経』の「小雅」の中にある篇の名前で、天子の長寿と平安を祈る詩。「九如」は「天保」の中で「如」の文字が九つ使われているということ。,0,0
