No.,種類（1.読み 2.表外読み 3.熟語一字訓 4.書き取り 5.四字熟語 6.対義語類義語 7.故事諺）,問題,問題例,解答,備考,正解数,間違い数
21,1,衿契,二人は<衿契>の間柄だ。,きんけい,心を許し合った友。非常に親しい交わり。,1,0
39,1,蝦芋,<蝦芋>は京野菜の一種だ。,えびいも,-,1,0
40,1,摸る,バッグの中を<摸る>。,さぐる,-,1,0
41,1,禄い,天に与えられた<禄い>に感謝する。,さいわい,-,1,0
84,1,蒼鷹,情け知らずの酷吏を<蒼鷹>にたとえた。,そうよう,羽毛が青色を帯びている鷹。しらたか。《1が猛々しいところから》情け容赦のない役人のたとえ。,0,0
93,1,而,我<而>に罪無きを知る。,なんじ,-,1,0
106,1,享通,<享通>の時に至る。,こうつう,物事が順調にはこぶこと。,0,0
107,1,苑ぐ,故に事大いに積めども<苑が>らず。,ふさぐ,ふさがる。つもる。,0,0
120,1,敦朴,<敦朴>な人柄の憎めない男である。,とんぼく,-,0,0
129,1,碓声,深更に至って漸く<碓声>が絶えた。,たいせい,臼を挽く音。,0,0
130,1,蔦葛,<蔦葛>を生い茂る藪を漕いで進んだ。,つたかずら,つる草の総称。,0,0
162,1,揖揖,若年にして白髪すでに<揖揖>たり。,しゅうしゅう,-,0,0
91,2,標,聖域の周りに<標>を結う。,しめ,土地の領有を示すため、また、場所を限るために木を立てたり縄を張ったりして、しるしとしたもの。,0,0
116,2,実,<実>しやかに述べ立てる。,まこと,-,0,0
154,2,上る,海の幸山の幸を<上る>。,たてまつる,-,0,0
171,2,豪い,それが先生の<豪い>ところだ。,えらい,-,1,0
172,2,精げる,米を精げる。,しらげる, 玄米をついて白くする。精白する。細工物などを磨いて仕上げをする。,0,0
1,3,曝書・曝す,<曝書>・<曝す>,ばくしょ・さらす,-,5,0
2,3,薫督・薫す,<薫督>・<薫す>,とうとく・ただす,-,5,0
22,3,遠猷・猷る,<遠猷>・<猷る>,えんゆう・はかる,遠い先のことまでよく考えたはかりごと。計略を立てること。,1,0
42,3,疏水・疏る,<疏水>・<疏る>,そすい・とおる,-,1,0
71,3,砥礪・礪く,<砥礪>・<礪く>,しれい・みがく,-,0,0
72,3,狭窄・窄まる,<狭窄>・<窄まる>,きょうさく・せばまる,-,0,0
78,3,嘉禎・禎い,<嘉禎>・<禎い>,かてい・さいわい,めでたいこと。,0,0
94,3,輿望・輿い,<輿望>・<輿い>,よぼう・おおい,世間一般の人々から寄せられる信頼・期待。衆望。「輿望を担う」,0,0
131,3,欽若・欽む,<欽若>・<欽む>,きんじゃく・つつしむ,つつしみ順う。,0,0
3,4,さえて,今日は頭が＜さえて＞いる,冴えて,-,5,0
4,4,わしづかみ,現金を<わしづか>みにして逃げた。,鷲摑み,-,5,0
5,4,ひんし,<ひんし>の子猫の命を救った。,瀕死,-,5,0
6,4,くら,馬に<くら>を置く。,鞍,-,5,0
7,4,せっけん,周辺の国々を<せっけん>していく。,席捲,-,4,0
8,4,せっこう,敵陣に<せっこう>を放つ。,斥候,-,3,0
9,4,せっこう,<せっこう>像をデッサンした。,石膏,-,3,0
10,4,こうしょう,時代の<こうしょう>が変化した。,好尚,-,2,0
23,4,りょうせん,<りょうせん>を伝って頂上を目指す。,稜線,-,1,0
24,4,そうく,白髪<そうく>の老紳士に出会った。,痩躯,-,1,0
25,4,しい,<しい>的に対策を決める。,恣意,-,1,0
26,4,こしき,<こしき>床しい,古式,-,1,0
27,4,かど,国家反逆罪の<かど>で逮捕される。,廉,-,1,0
43,4,きがい,必ず再起するとの<きがい>がある。,気概,-,1,0
67,4,くわ,畑に<くわ>を入れる。,鍬,-,0,0
68,4,しょうかい,<しょうかい>艇が密漁船を捕らえた。,哨戒,-,0,0
73,4,りょうせん,<りょうせん>に続いて沖に出る。,僚船,-,0,0
79,4,かしん,全国各地の<かしん>に接する。,花信,花が咲いたという知らせ。花便り。,0,0
80,4,ぎょしん,忽ち強烈な<ぎょしん>があった。,魚信, 釣りで、魚が餌をくわえたことが、竿や糸などから伝わってくること。あたり。,0,0
81,4,しょうち,秋の信濃路に佳境<しょうち>を求める旅に出た。,勝地,景色のよい所。景勝の地。,0,0
82,4,いらく,寂滅<いらく>の浄地に遊ぶの想いあらしむ。,為楽,本当の楽しみとすること。ことに、涅槃についていう。,0,0
85,4,いかい,父の<いかい>を肝に銘ずる。,遺戒,-,0,0
86,4,じかい,終生<じかい>の僧であった。,持戒,-,0,0
87,4,しょうずい,事の成る前、屡<しょうずい＞が現れた。,祥瑞,-,0,0
95,4,さやあて,人目はばからず恋の＜さやあて>を演じる。,鞘当て,-,0,0
96,4,とてつ,<とてつ>もない金額を請求された。,途轍,-,0,0
97,4,しんたん,世人の<しんたん>を寒からしめる。,心胆,-,0,0
105,4,にんずる,豪の者を以て<にんずる>彼も戦慄した。,任ずる,-,0,0
108,4,けいし,桜の咲き匂う<けいし>を訪れる。,京師,東アジアなど漢字文化圏で帝王の都のこと。京都[1]。京城。,0,0
109,4,しひょう,世の<しひょう>として畏敬される。,師表,世の人の模範・手本となること。また、その人。「後人の師表となる」,0,0
118,4,きんちゃく,<きんちゃく>袋に収納する。,巾着,-,0,0
119,4,ゆうとう,<ゆうとう>ばかりで惰弱である。,遊蕩,-,0,0
121,4,ほうとう,<ほうとう>を掲げて世の闇を照らす。,法灯,仏法がこの世の闇やみを照らすことを灯火にたとえていう語。,0,0
122,4,ほうもう,巧妙に<ほうもう>をくぐる。,法網,法律という網。不正を行えば、法律で罰せられることを精密な網にたとえていう語。,0,0
128,4,しょうよう,<しょうよう>者は愛すべし。,少幼,-,0,0
132,4,せんしょう,銘々に<せんしょう>ならざる功績があった。,鮮少,「尠少」非常に少ないこと。また、そのようす。「―な事例と心得る」,0,0
133,4,ほうせん,古来政の要訣を<ほうせん>にたとえる。,烹煎,①生魚をにること。 ②国を治めるのにあせって余計な策を施すと、かえって効果の上がらないたとえ。小魚をにるとき、手を加えすぎると崩れてしまうことから。「鮮」は生魚の意。,0,0
134,4,りゅうぐう,異郷に<りゅうぐう>する我が身を託つ。,流寓,放浪して異郷に住むこと。,0,0
153,4,かしゃく,毫も<かしゃく>する所がない。,仮借,許すこと。見逃すこと。「仮借なく罰する」,0,0
155,4,いっせきがん,近時、<いっせきがん>を具する人を見ない。,一隻眼,物事を見抜くすぐれた観察眼。ひとかどの見識。,0,0
156,4,いっていじ,目に<いっていじ>もない無学の己を恥じる。,一丁字,一つの字をも知らない。無学である。,0,0
161,4,しんえん,<しんえん>狂い、意馬跳る。,心猿,欲情に燃えて落ち着かないようすを、猿がわめき騒ぐのにたとえた語。「意馬心猿」,0,0
163,4,こうひ,今も村の<こうひ>が残る。,口碑,《石碑のようにながく後世にのこる意》古くからの言い伝え。伝説。「口碑に残る悲話」,0,0
164,4,こうぜつ,<こうぜつ>の徒を嫌忌する。,口舌,口先だけの言葉。物言い。くぜつ。,0,0
165,4,しし,<しし>相承によって現在に伝わっている。,師資,武芸や学問などの教えを師から弟子へと受け継ぐこと。,0,0
166,4,がじゅん,流麗かつ<がじゅん>な格調高き文章。,雅馴, 文章が品があって洗練されていること。言葉遣いや筆づかいが正しく、練れていること。また、そのさま。,1,0
11,5,ぜんとりょうえん,<ぜんとりょうえん>,前途遼遠,目的を達成するまでの道のりが、はるかに遠くて困難なさま。,2,0
12,5,そうじんふぎょ,<そうじんふぎょ>,甑塵釜魚,長い間使わずにいるので、蒸し道具の甑には塵が積もり釜の中には魚が泳いでいるという故事から、貧しくて食べるにも事欠くさま。,2,0
13,5,きょくこうのたのしみ,<きょくこうのたのしみ>,曲肱之楽,富を求めずに、貧しくても正しい行いをする楽しみのこと。または、貧しい暮らしをしていても、その中に楽しみはあるということ。「曲肱」は枕が買えないために腕を曲げて、肘を枕にするという意味。,1,0
14,5,ほうとうひしゅう,<ほうとうひしゅう>,朋党比周,仲間を作って結託して、それ以外の人を排斥すること。「朋党」は考えや利害が同じ仲間のこと。「比周」は片方だけと仲良くすること。主に悪い意味で使われる言葉で、徒党を組んで悪事を働く場合などに使われる。,1,0
15,5,たいろうのじみ,<たいろうのじみ>,太牢滋味,立派で豪華な料理のこと。「太牢」は祭りの時に供えるいけにえという意味から、牛、羊、豚の三種の肉のこと。「滋味」はおいしい食べ物のこと。,1,0
16,5,おんぶんじが,<おんぶんじが>,温文爾雅,心がおだやかで、態度や言動が礼儀にかなっていること。「温文」は温和で礼儀にかなっていること。「爾雅」は言葉や文章などが美しいこと。「爾雅温文」ともいう。,1,0
17,5,ちゅうりゅうのしちゅう,<ちゅうりゅうのしちゅう>,中流砥柱,苦しく辛い状況でも動じずに節操を守る人のたとえ。「中流」は川の流れの激しい場所。「砥柱」は中国の黄河の中にそびえ立つ滑らかな岩の名前。砥柱は激しい流れの川の中でも堂々と立っていることから。,2,0
28,5,しっしんどんたん,<しっしんどんたん>,漆身呑炭,仇討ちや復讐をするために、非常に苦労すること。「漆身」は漆を身体に塗る、「呑炭」は炭を呑むこと。,1,0
29,5,こうがんあいめい,<こうがんあいめい>,鴻雁哀鳴,離散してさまよう民が、苦労や窮状を訴えることのたとえ。鴻（おおとり）と雁（”がん”または”かり”）を流浪の民をたとえたもの。,1,0
30,5,きゅうていたいりょ,<きゅうていたいりょ>,九鼎大呂,貴重な物や重要な地位のたとえ。,1,0
31,5,えんぼくけいちん,<えんぼくけいちん>,円木警枕,苦労を厭わずに勉学に励むたとえ。,1,0
32,5,じょうりんぼんかい,<じょうりんぼんかい>,常鱗凡介,普通の人のたとえ。,1,0
44,5,ばくしゅうしょり,<ばくしゅうしょり>,麦秀黍離,亡国の嘆き。麦の穂や黍が繁る意。,1,0
45,5,ちらんこうぼう,<ちらんこうぼう>,治乱興亡,世の中がよく治まることと、乱れて滅びること。,0,0
46,5,きんけんりっこう,<きんけんりっこう>,勤倹力行,仕事に励み、倹約し、精一杯努力すること。,0,0
47,5,ふくりょうほうすう,<ふくりょうほうすう>,伏竜鳳雛,臥竜鳳雛。優れた才能を持ちながらまだ世に知られていない大人物。また将来有望な若者のたとえ。,0,0
48,5,さんそうぞうしつ,<さんそうぞうしつ>,山藪蔵疾,大人物は多少の欠点はあっても、あらゆる人を包含する度量の広さがあること。,0,0
49,5,せいえいてんかい,<せいえいてんかい>,精衛塡海,実現不可能な計画を立てて失敗し、無駄な努力となること。または、いつまでたっても悔やんでいること。「精衛」は伝説上の小鳥の名前。「塡海」は海を埋めること。伝説上の皇帝炎帝の娘である女娃は東海で溺れ死んだ。女娃は伝説上の小鳥「精衛」に化身し、自身の死んだ東海を小石や小枝などで埋めようとしたが、失敗に終わったという故事から。,0,0
50,5,ばいさいかくし,<ばいさいかくし>,梅妻鶴子,俗世を離れた清らかで風流な隠遁生活のこと。妻のかわりに梅の木を、子のかわりに鶴を愛でて、一人で清らかに風雅に暮らしたという故事から。,0,0
51,5,よばふうち,<よばふうち>,輿馬風馳,速度が並外れて速いことのたとえ。「輿馬」は乗り物と馬のこと。「風馳」は風のように速く走ること。,0,0
52,5,こししゅきゅう,<こししゅきゅう>,狐死首丘,生まれ育った地を忘れないことのたとえ。または、物事の根本を忘れないことのたとえ。狐は、死ぬときに生まれ育った丘に頭を向けて死ぬということから。,0,0
53,5,しんくそうほう,<しんくそうほう>,辛苦遭逢,非常に辛く苦しい出来事にあうこと。,0,0
54,5,りゅうちょうこが,<りゅうちょうこが>,竜跳虎臥,筆づかいが縦横自在なこと。,0,0
55,5,ごどういちよう,<ごどういちよう>,梧桐一葉,物事が衰える前兆のこと。「梧桐」は植物のあおぎりのこと。あおぎりは他の木よりも早く葉が落ちるとされ、あおぎりの葉が一枚落ちるのを見て、秋が来ることを知るという意味から。,0,0
56,5,とまつししょ,<とまつししょ>,塗抹詩書,幼児のこと。また、幼児のいたずらのたとえ。,0,0
57,5,てつもうさんご,<てつもうさんご>,鉄網珊瑚,珍しい品物や、素晴らしい才能をもつ人物を得るために探すこと。海の底に鉄の網を沈めて、それに着生させ、成長したあとに引き上げて珊瑚を採取するという、唐の時代に東ローマ帝国で行われたとされる方法から。,1,0
58,5,かんざんじっとく,<かんざんじっとく>,寒山拾得,中国の唐の時代の二人の高僧で、文殊菩薩と普賢菩薩の生まれ変わりとされている、寒山と拾得のこと。,0,0
59,5,たいえきのふよう,<たいえきのふよう>,太液芙蓉,美人の顔のたとえ。「太液」は漢代には未央宮の北にあった池の名前のこと。「芙蓉」は蓮の花のこと。,0,0
74,5,てんじょうむきゅう,<てんじょうむきゅう>,天壌無窮,いつまでも終わることなく、天と地と共に続いていくこと。,0,0
75,5,はいしゅかいえん,<はいしゅかいえん>,杯酒解怨,杯を酌み交わして、怨みを忘れるという意味。,0,0
76,5,でいしゃがこう,<でいしゃがこう>,泥車瓦狗,役に立たないもののこと。「泥車」は泥で作られた車。「瓦狗」は瓦で作られた犬。,0,0
77,5,ばんしょせんちん,<ばんしょせんちん>,万杵千砧,きぬたを打つたくさんの女性。または、いろんなところから聞こえるきぬたの音。「万」と「千」は数が多いことのたとえ。「杵」はきぬたを打つための棒。「砧」は布を叩いて柔らかくして、つやを出すための石や木の台。,0,0
83,5,あんしゃほりん,<あんしゃほりん>,安車蒲輪,老人をいたわり、丁重にもてなすこと。「安車」は老人や妊婦が座れるように仕立てられた小車のこと。「蒲輪」は蒲の穂で車輪を包み、振動を抑えて乗り心地をよくしたもの。,0,0
92,5,はくいしゅくせい,<はくいしゅくせい>,伯夷叔斉,私欲がなく清らかな人格の人のたとえ。「伯夷」と「叔斉」はどちらも人の名前。,0,0
98,5,ときえんばく,<ときえんばく>,兎葵燕麦,名前と実体が伴っていないこと。「兎葵」は植物のいえにれ。「燕麦」は植物のからすむぎ。名前に「葵」や「麦」があるが、実際には違うということから。,0,0
99,5,ばんこんさくせつ,<ばんこんさくせつ>,盤根錯節,事情が複雑で解決することが難しいこと。「槃根」は曲がりくねった木の根のこと。「錯節」は入り組んだ木の節のこと。,0,0
100,5,いっしはんせん,<いっしはんせん>,一紙半銭,ごくわずかなことのたとえ。「一紙」は一枚の紙のこと。「半銭」は半文の銭のこと。,0,0
110,5,きゅうぼくふんど,<きゅうぼくふんど>,朽木糞土,やる気がなく、だらしない人を教育することはできないということのたとえ。または、役に立たないもののたとえ。腐ってぼろぼろになっ木と土壁ということで、腐った木材に彫刻することはできず、腐った土壁に上塗りをすることはできないという意味。,0,0
111,5,はんげきふんじょう,<はんげきふんじょう>,繁劇紛擾,多忙を極めて、混乱すること。「繁劇」は多忙を極める。「紛擾」はまとまりがなく、わけがわからなくなること。,0,0
123,5,きょしんたんかい,<きょしんたんかい>,虚心坦懐,-,0,0
124,5,ちゅうざんしゃかい,<ちゅうざんしゃかい>,鋳山煮海,たくさんの財産を蓄えること。または、山や海の資源が豊かなこと。「鋳山」は山から銅を採掘して銅貨を作ること。「煮海」は海水を煮て塩を作ること。,0,0
125,5,ちょうひょうがし,<ちょうひょうがし>,凋氷画脂,苦労するだけで、なんの成果も得られないこと。氷に彫刻して、脂に絵を描くという意味で、どちらも跡形も無くなるということから。,0,0
126,5,こうはがてつ,<こうはがてつ>,侯覇臥轍,善政を行った立派な人物の留任を願って、引き止めること。「侯覇」は中国の後漢の人の名前。「臥轍」は車の通り道で、人が伏して通れなくすること。,1,0
135,5,ろっこんせいじょう,<ろっこんせいじょう>,六根清浄,欲望や迷いを断ち切り、心と体を清らかにすること。「六根」は仏教で煩悩や迷いなどの元になるとされる六つの器官のことで、眼・耳・鼻・舌・身・意のことをいう。「清浄」は煩悩や迷いなどを捨てて、汚れがなく清らかなこと。,0,0
136,5,てっちょうせきしん,<てっちょうせきしん>,鉄腸石心,鉄や石のように固く強い心と意志のこと。,0,0
137,5,かとらくしょ,<かとらくしょ>,河図洛書,非常に珍しく、価値のある書物のこと。「河図」は、『易経』の八卦の元になったとされる図で、中国の伏羲の時代に黄河から現れた竜馬の背中にあった、渦巻いた毛の模様を写し取ったものとされている。「洛書」は、『書経』の「洪範伝」の元になったとされる文で、夏の禹王の時代に、洛水という川の洪水を治めた後に現れた神亀の背中に記されていた文字を書き写したものとされている。,0,0
138,5,きゅうそごうびょう,<きゅうそごうびょう>,窮鼠噛猫,弱者でも追い詰められて必死になれば、予期していない力をだして、強者を倒すことがあるということのたとえ。,0,0
139,5,しょじょだっと,<しょじょだっと>,処女脱兎,兵法の一つで、始めのうちは大したことのないように見せて相手を油断させ、後にものすごい勢いを発揮することのたとえ。「処女」は家にいる少女という意味から、未婚の少女のこと。「脱兎」は逃げる兎。,0,0
140,5,めいせんけっき,<めいせんけっき>,鳴蝉潔飢,気高く清らかな心を持つ者は、いかなる状況でも信念を曲げないことのたとえ。蝉は気高い心を持ち、たとえ飢えても露以外のものを口にしないという伝説に由来する。,0,0
141,5,きゃっかしょうこ,<きゃっかしょうこ>,脚下照顧,他人の批判をする前に、自分の過去の言動を見つめ直してよく考えるべきであるという自己反省の教え。,0,0
142,5,にょぜがもん,<にょぜがもん>,如是我聞,仏教で経文の冒頭に記される定型の言葉。「私はこのようにお聞きしました」という意味。,0,0
143,5,りゅうあんかめい,<りゅうあんかめい>,柳暗花明,「柳暗」は柳が茂って薄暗いこと、「花明」は花が明るく咲くことから、春の美しい景観の形容。または、芸者や遊女の社会のこと。,0,0
144,5,しんこうきふ,<しんこうきふ>,神工鬼斧,人の技術で作られたとは思えない素晴らしい作品のこと。神が細工を施したような、鬼神が斧をふるって作ったような作品という意味から。,0,0
145,5,こうはつはは,<こうはつはは>,黄髪番番,白髪が黄色がかるほどに歳老いた老人のこと。知識や経験を重ねた老人をいう言葉。「黄髪」は黄色がかった白髪ということから、老人のたとえ。「番番」は白髪のこと。,0,0
146,5,しゅれんへきごう,<しゅれんへきごう>,珠聯璧合,才能のある多くの人材が一つのところに集まること。または、結婚を祝う言葉。,0,0
147,5,せきざんすんすい,<せきざんすんすい>,尺山寸水,高い山の上から見下ろした景色。「尺」と「寸」はどちらも長さの単位で、どちらも短い長さのたとえ。上から見た他の山や川が小さく見えるということから。,0,0
148,5,おんじんりく,<おんじんりく>,遠塵離垢,けがれから遠ざかり、煩悩から離れること。,0,0
149,5,しゅっこくせんきょう,<しゅっこくせんきょう>,出谷遷喬,出世すること。「遷喬」は高い木に移ること。鳥が谷から出てきて高い木に移るということから、高い地位を手に入れることのたとえ。,0,0
167,5,しょうしじだい,<せいしじだい>,生死事大,生か死かは最も大切な問題だが、今生きていることが最も大切であるということ。,0,0
168,5,じゅうていちょうせき,<じゅうていちょうせき>,獣蹄鳥跡,世の中が酷く乱れていること。「獣蹄」は獣の足跡。獣や鳥の足跡が町中に溢れるという意味から。,0,0
18,6,てんまつ,経緯⇔<てんまつ>,顛末,-,1,0
33,6,きゅうきゅう,悠悠⇔<きゅうきゅう>,汲汲,-,1,0
34,6,はいち,遵奉⇔<はいち>,背馳,-,1,0
60,6,しだん,排撃＝<しだん>,指弾,-,0,0
61,6,けんがい,絶壁=<けんがい>,懸崖,-,0,0
62,6,りゅうしょう,繁栄=<りゅうしょう>,隆昌,-,0,0
63,6,ちぎ,童心=<ちぎ>,稚気,-,0,0
69,6,うぐ,賢明⇔<うぐ>,迂愚,-,0,0
88,6,こぎ,敢行⇔<こぎ>,狐疑, 相手が悪意を持っているのではないかと疑うこと。猜疑(さいぎ)心を持つこと。,0,0
89,6,ちし,出仕⇔<ちし>,致仕,官職を退いて引退すること。,0,0
90,6,じんじつ,終日=<じんじつ>,尽日,一日じゅう。終日。,0,0
101,6,りゅうべつ,送別⇔<りゅうべつ>,留別,旅立つ人が、あとに残る人に別れを告げること。,0,0
102,6,いつび,過褒=<いつび>,溢美,褒めすぎること。過賞。,0,0
103,6,けいてい,懸隔=<けいてい>,径庭,二つのものが大きくかけはなれていること。かけへだて。へだたり。相違。懸隔。,0,0
104,6,けいごう,符号=<けいごう>,契合,合わせた割り符のようにぴったり一致すること。「両者の意見が契合する」,0,0
112,6,りゅうたい,消長=<りゅうたい>,隆替,盛んになることと衰えること。栄えたり衰えたりすること。,0,0
113,6,かいい,頓着=<かいい>,介意,意に介すること。気にかけること。心にとめること。,0,0
117,6,ふうたい,正味⇔<ふうたい>,風袋,１ はかりで物の重さを量るとき、それを入れてある容器・袋・箱など。「風袋こみの目方」２ 実質に対しての外観。うわべ。見かけ。「風袋ばかりりっぱな人」,0,0
127,6,がりょう,襟度（きんど）=<がりょう>,雅量,人をよく受け入れるおおらかな心。「雅量に富む人」「雅量を示す」,0,0
150,6,そうせい,民草=<そうせい>,蒼生,多くの人々。人民。あおひとぐさ。蒼氓（そうぼう）。,0,0
157,6,じゅうご,前線⇔<じゅうご>,銃後,-,0,0
169,6,ちんとう,斬新⇔<ちんとう>,陳套,きまりきっていて古くさいこと。また、そのさま。陳腐。旧套。,0,0
19,7,ひがめ,親の欲目と他人の<ひがめ>,僻目,親は自分の子を贔屓目に見るが、他人は実際よりも厳しい評価をする傾向があること。,3,0
20,7,さぎ,<さぎ>を烏と言いくるめる,鷺,明らかに間違っていることを、正しいと主張して無理やり押し通すこと。,2,0
35,7,りか,<りか>一枝春雨を帯ぶ。,梨花,美しい人が悲しむ姿のたとえ。,2,0
36,7,きんゆう,遠慮なければ<きんゆう>あり,近憂,将来のことを考えず目先のことに気をとられていると、必ず近いうちに心配事が起こる。,1,0
37,7,ちょうもん,<ちょうもん>の一針。,頂門,急所をついて厳しく戒めること。,1,0
38,7,ひんせん,<ひんせん>も移す能わず。,貧賤,どんなに貧しい境遇でも、固い意思を持っていてその行いを変えることがないということ。,1,0
